"","category","name","price","ratings","no_of_reviews"
"1","PetSupplies","Check each product page for other buying options. Price and other details may vary based on product size and colour.","5.","3.9 out of 5 stars","483"
"2","PetSupplies","Cat Professional Recovery Suit for Abdominal Wounds or Skin Diseases, Kitten Surgery Recovery Suit E-Collar Alternative for Cats After Surgery Wear Pajama Suit (S Size, Pink)","6.","3.8 out of 5 stars","69"
"3","PetSupplies","Small Dog Hoodie,Fashion Soft Cotton Fleece Pet Security Hoodie Hooded Clothes Warm Autumn Winter Coat Puppy Hoodie T-Shirt Clothes Costume Apparel for Puppy Small Dogs Black","4.","4.0 out of 5 stars","574"
"4","PetSupplies","Small Dog Jumper, Warm Puppy Sweater for Dogs Winter Knitted Pullover Soft Turtleneck Clothes Vest Pet Autumn, Outfit Yorkshire, Chihuahua, Welsh Corgi, Cat (S, Purple)","8.","4.1 out of 5 stars","20"
"5","PetSupplies","Dog Jacket Coat for Small Dogs Cats Winter Warm Puppy Clothes with D-Ring for Harness Leash Soft Zipper Jacket Cold Weather Pet Apparel Clothing for Chihuahua Yorkie Gray M","9.","4.0 out of 5 stars","1,703"
"6","PetSupplies","Small Dogs Jumpers Soft Fleece Vest Dog Sweatshirt, Puppy Kittens Winter Clothes Warm Jacket Coat Cold Weather Apparel Pet Pajamas Warm Tshirt for Sphynx Hairless Cat Chihuahua Bulldogs Pink S","13.","4.0 out of 5 stars","26"
"7","PetSupplies","Sphynx Cats Pullover, Cat Turtleneck Sweater Jumper Kitten Fleece Winter Clothes Cat Pajama Warm Jumpsuit Cat Bodysuit Shirt for Sphynx Cornish Rex Devon Rex Peterbald(Grey, S)","7.","3.8 out of 5 stars","39"
"8","PetSupplies","Cute Cat Warm Jumper Sweater Pet Bow Knitwear Winter Dog Clothing Small Puppy Coat Dog Sweater for Chihuahua Yorkshire Christmas Apparel Clothes (Pink, Gray)","3.","4.0 out of 5 stars","94"
"9","PetSupplies","Cat Sunglasses, Retro Kitten Sunglass with Rose Gold Chain Eye UV Protection Classic Small Cat Glasses Cosplay Costume for Photo Props Cute Pet Decorations for Birthday Party","8.","4.2 out of 5 stars","1,018"
"10","PetSupplies","Lion Mane Wig for Dog and Cat Costume Pet Adjustable Washable Comfortable Fancy Lion Hair Dog Clothes Dress for Halloween Christmas Easter Festival Party Activity","10.","4.0 out of 5 stars","114"
"11","PetSupplies","Hairless Cat Cotton Clothes, Sphynx Breathable Summer T-Shirts Stripe Vest Pet Clothes, Soft Stretchable Skin-Friendly Cats Apparel Cat's Pajamas Jumpsuit for Sphynx, Cornish Rex, Devon Rex Peterbald","5.","4.1 out of 5 stars","356"
"12","PetSupplies","Fleece Dog Jumper Winter Warm Sweater Jacket Coat for Small Dogs Soft Fuzzy Puppy Clothes with D-Ring for Harness Leash Pullover Cold Weather Pet Girl Boy Apparel for Chihuahua Cats Blue S","9.","4.0 out of 5 stars","363"
"13","PetSupplies","Cat Sweater Vest Clothes, Soft Warm Jumpsuit Cat Sweatshirt Puppy Kittens Winter Coat Jacket Clothes Pet Pajama Costume Apparel Pet Outifit for Sphynx Cat (Green, XS)","7.","4.2 out of 5 stars","1,835"
"14","PetSupplies","Small Dog Clothes Coat Winter Fleece Warm Puppy Jacket Apparel Chihuahua Sweater Clothing Pet Cat Doggie Boys Girls Jumper Brown M","4.","3.9 out of 5 stars","96"
"15","PetSupplies","Cat Surgical Recovery Suit, E-Collar Alternative for Cats Dogs After Surgery Wear Pajama Suit Home Indoor Pets Clothing Doughnut (Medium)","5.","3.8 out of 5 stars","439"
"16","PetSupplies","Pet Ribbed Fleece Jumpers Pullover Sweatshirt for Small Dogs Cat,Puppy Yorkie Chihuahua Warm Sweater Winter Clothes","4.","4.0 out of 5 stars","3"
"17","PetSupplies","Pet Scarf, Cute Pet Apparel Cat Accessories Red Winter Knitted Scarf with Tassel Pom Poms, Chinese New Year Pet Supplies Neck Warmer Neckerchief for Cats, Kitten, Dogs, Puppy, Pet (Size L)","4.","4.2 out of 5 stars","132"
"18","PetSupplies","Dog Jumper Winter, Turtleneck Knitting Sweater Winter Warm Coat Puppy Pullover Cable Knitted Clothes Outfit Knit Jumper Cat Jacket Apparel Sweatshirts Chihuahua Poodle Christmas Clothing(Grey, XS)","6.","4.1 out of 5 stars","4"
"19","PetSupplies","Pet Costume,Funny Nun Costume with Hat,Cute Pet Dog Cat Clothes Suit Outfit for Halloween Christmas Holiday Dress Up Cosplay Shirts Apparel Outfit Uniform","7.","4.1 out of 5 stars","905"
"20","PetSupplies","Small Dog Jumpsuit Pyjamas Overalls Soft Cotton Rompers Adorable Donut Printed Puppy Sleeping Clothes Four Legs Pjs Apparel for Pet Cats Pups M","12.","4.0 out of 5 stars","41"
"21","PetSupplies","Sphynx Cat Clothes, Breathable Soft Cat Jumpers For Cats Only, Cat Coat with Four Legs, Warm Cat Sweaters, Cat T-Shirt, Cat Pajamas Jumpsuit Vest for Sphynx, Cornish Rex, Devon Rex,Peterbald","7.","3.9 out of 5 stars","370"
"22","PetSupplies","Dog Warm Coat Cute Pet Puppy Cat Jumper Sweater Knitwear Apparel Clothes, Blue (S)","6.","3.8 out of 5 stars","12"
"23","PetSupplies","Brand Winter Pet Jumper and Sweater for Cats and Dogs - Cozy and Warm Pet Clothing","5.","4.1 out of 5 stars","1"
"24","PetSupplies","Cat Clothes Cat Halloween Costume Cute Puppy Dog Cat Cosplay Funny Cloths Dress Up Cowboy Outfit Pet Halloween Costume Cowboy Dog Costume Halloween Cat Costume(Cowboy, L)","3.","4.1 out of 5 stars","85"
"25","PetSupplies","Small Dog Hoodie,Fashion Soft Cotton Fleece Pet Security Hoodie Hooded Clothes Warm Autumn Winter Coat Puppy Hoodie T-Shirt Clothes Costume Apparel for Puppy Small Dogs Black","6.","4.1 out of 5 stars","4"
"26","PetSupplies","Cat Camouflage Recovery Suit, Pet Surgery Suit, Pet Physiological Clothes, Cat Onesie Anti Licking Vest Shirt, Cone E-Collar Alternative Bodysuit for Abdominal Wounds Skin Diseases (M)","4.","4.0 out of 5 stars","10"
"27","PetSupplies","Turtleneck Small Dog Jumper,Dog Sweater Winter Puppy Clothes Cute Knitted Vest for Knit Cold Weather Outfit Dogs and Cats (L), Green","9.","3.8 out of 5 stars","49"
"28","PetSupplies","Cat Recovery Suit after Surgery Cat Bodysuit Medical Vest Cat Suit Post Surgery Kitten Recovery Suit after Spaying Anti Lick Suit Pet Recovery Clothing","9.",NA,"498"
"29","PetSupplies","Cat Wound Surgery Recovery Suit for Abdominal Wounds or Skin Diseases, After Surgery Wear, Pyjama Suit, E-Collar Alternative for Cats and Dogs (L, Stripe Blue)","5.",NA,"17"
"30","PetSupplies","Pet Halloween Costumes Cape Dog Cat Halloween Apparels Cosplay Costume Pet Wizard Costume Cloak for Halloween Party Cosplay Photo Prop (Red, S)","7.",NA,"1,587"
"31","PetSupplies","Small Dog Cat Winter Coat Harness Jacket with D-ring Boy Girl Pet Puppy Comfort Padded Bomber Vest No Pull Chihuahua Clothes Pink Leopard S","8.",NA,"1,784"
"32","PetSupplies","Christmas costumes,The Cowboy for Party Christmas Special Events Costume,West CowBoy Uniform with Hat, Funny Pet Cowboy Outfit Clothing for Dog Cat (S)","6.",NA,"563"
"33","PetSupplies","Small Dog Spoiled Hoodie Chihuahua Clothes for Girls Crown Puppy Tee T shirt for Cat Yorkshire Toy Poodle Pink XS","6.",NA,"5"
"34","PetSupplies","2 Pairs Cat Paw Gloves, Winter Gloves Womens Furry Paws Gloves, Kawaii Plush Warm Gloves, Half Finger Gloves Thermal Mittens For Teens Girls Halloween Cosplay (Black, Grey)","9.",NA,"1,223"
"35","PetSupplies","2 Pack Dog Jumper Fleece Warm Pet Dog Cat Sweater Pullover Soft Thickening Knitwear Puppy Kitten Sweatshirts Knitted Jacket Coat for Small Medium Dogs Hoodies Apparel (M, Purple+Blue)","8.",NA,"146"
"36","PetSupplies","Dog Jumpers Small Medium Pet Dog Cat Sweater with Legs Soft Warm Knitted Pullover Clothes Boys Girls Puppy Knitwear Cat Sweatshirt Coat Apparel (Pink,S)","4.",NA,"5"
"37","PetSupplies","Bandana, Princess Costumes Cute Lace Crown Accessories for Cats Small Dogs, Pink Outfit for Birthday Party","8.",NA,"123"
"38","PetSupplies","Dog Plush Pullover,Warm Pet Fleece Sweatshirt for Dog Cat,Winter Dog Fleece Jumpers,Puppy Kitten Chihuahua Pullover Sweater with Bear Pattern,Winter Warm Clothes for Small Medium Dogs Cats (2XL, Blue)","18.",NA,"314"
"39","PetSupplies","Recovery Suit Cat, Cat Bodysuit After Surgery, Anti-Leaking, Prevent Licking After Surgery, Weaning and Keeping Warm Recovery Cloth Suit for Cats, Dogs (M, Pink)","4.",NA,"30"
"40","PetSupplies","Thigh High Socks, Pink 3D Kitten Claw Stockings Cute Cat Paw Pad Socks for Girls Women Cat Cosplay","6.",NA,"4"
"41","PetSupplies","2 Pack Dog Shirts Small Dog Clothes Pet Shirts Puppy Fruit Printed T-Shirt Summer Thin Vest Soft Breathable Puppy Sweatshirt Cool Outfit Pyjamas Apparel for Small Dogs Puppies Cats (S)","7.",NA,"81"
"42","PetSupplies","Girls Party T-Shirt | Young Ladies Lets Pawty Birthday Cake Graphic Tee | Cute Kitty Short Sleeve Top Lightweight Internet Cat Apparel | Adorable Daywear Merchandise Gift for Children & Teens","5.",NA,"2"
"43","PetSupplies","Dog Sweater, Turtleneck Dog Jumper, Pullover Puppy Winter Clothes Cat, Puppy Winter Clothes, Chihuahua Clothes Yorkshire, Dog Accessories for Small Dogs (Small, Black)","8.",NA,"177"
"44","PetSupplies","Cat Professional Recovery Suit for Abdominal Wounds or Skin Diseases, E-Collar Alternative for Cats and Dogs, After Surgery Wear, Pajama Suit (Elephant Pattern, S)","8.",NA,"2"
"45","PetSupplies","Small Dog Hoodies Clothes Cotton, Warm Puppy Clothes Pullover, Sof Puppy Kittens Cotton Hoodies Coat, Pet Hooded Clothes for Small Dog Cat Winter Sweatshirt (L, Navy blue)","4.",NA,"1,354"
"46","PetSupplies","Cat Clothes Winter Hillylolly Pet Jumper Cat Sweater Warm Cat Clothing Cute Knitted Jumper for Cats Clothing Pink Strawberry Sweater Winter Pet Clothes (S)",NA,NA,"2"
"47","PetSupplies","Dog Cat Knitted Jumper Pullover Washable Puppy Purple Sweater Coat Winter Warm Pet Pullover Sweater Coat for Small Medium Puppy Cat Vest Knitwear Sweatshirt Outfit for Yorkshire Chihuahua (S, Purple)",NA,NA,NA
"48","PetSupplies","Outdoor Puppy Pet Rain Coat with Hood Waterproof Jackets PU Reflective Raincoat for Dogs Cats Apparel Clothes",NA,NA,NA
"49","PetSupplies","Check each product page for other buying options. Price and other details may vary based on product size and colour.","6.","3.8 out of 5 stars","4"
"50","PetSupplies","Pet Costume,Funny Nun Costume with Hat,Cute Pet Dog Cat Clothes Suit Outfit for Halloween Christmas Holiday Dress Up Cosplay Shirts Apparel Outfit Uniform","6.","3.8 out of 5 stars","1"
"51","PetSupplies","Winter Cat Ears Hat Knitted Cap Striped Knit Beanie Hat 1Piece, Trendy Winter Warm Crochet Cap Vintage Crochet Hats for Causal Home Office School Hiking","5.","4.0 out of 5 stars","99"
"52","PetSupplies","Christmas Snowflake Elk Pattern Pet Clothes,Cat Dog Christmas Outfit, Small Medium Dogs Cats Christmas Costumes, New Year Clothing Accessories for Small Pet Cat Dog (Snowflake-XS)","5.","4.1 out of 5 stars","598"
"53","PetSupplies","Dog Hoodie, Dog Clothes Sweater Dog Jumpsuit Fleece Sweatshirt Dog Outfit Dog Winter Clothes Cotton Puppy Hoodies for Small Medium Large Dogs Cats Apparel Navy blue","13.","4.0 out of 5 stars","33"
"54","PetSupplies","Classic Soft Knit Cat Jumper Dog Sweater, Turtleneck Knitwear Puppy Clothes for Puppy Cat Boy Girl, Cute Kitten Doggies Ugly Christmas Holiday Pet Apparel, LightBlue S","8.","4.1 out of 5 stars","41"
"55","PetSupplies","Cat Dog Princess Costumes Puppy Cat Birthday Bandana Scarf and Party Hat Cute Lace Dog Bib Scarf and Birthday Hat Doggy Cat Birthday Party Decorations Set","3.","4.2 out of 5 stars","854"
"56","PetSupplies","Cat Sunglasses-Cat UV Protection Classic Retro Small Dog Sun Glasses Dolls Round Sunglasses Party Cosplay Costume Photo Props Cute Funny Sunglasses (1Pc Round Glasses+1Pc Gold Chain),Rose Gold","4.","3.8 out of 5 stars","3"
"57","PetSupplies","Pet Scarf, Cute Pet Apparel Cat Accessories Red Winter Knitted Scarf with Tassel Pom Poms, Chinese New Year Pet Supplies Neck Warmer Neckerchief for Cats, Kitten, Dogs, Puppy, Pet (Size L)","17.","4.2 out of 5 stars","2"
"58","PetSupplies","Disney Boys Alice in Wonderland Cheshire Cat Colour T-Shirt Baby Pink 12-13 Years","5.","4.2 out of 5 stars","366"
"59","PetSupplies","Small Dog Hoodies Clothes Cotton, Warm Puppy Clothes Pullover, Sof Puppy Kittens Cotton Hoodies Coat, Pet Hooded Clothes for Small Dog Cat Winter Sweatshirt (L, Navy blue)","17.","4.0 out of 5 stars","122"
"60","PetSupplies","5 Pieces Cat Hat Adorable Costume Bunny Rabbit Hat with Ears Funny Frog Lion Mane Sunflower Banana Cat Hat for Cats and Small Dogs Kitten Puppy Party Costume Halloween Accessory Headwear, 5 Styles","5.","3.9 out of 5 stars","72"
"61","PetSupplies","Cat Birthday Bandana Cute Dog Birthday Hat Pets Birthday Party Supplies Birthday Outfit for Cat and Dog Pink A","24.","4.1 out of 5 stars","81"
"62","PetSupplies","Oversized Wearable Blanket Hoodie Kids | Girls Tabby Cat Snacks Fluffy Sherpa Fleece Pullover Vuddie | One Size Sweatshirt with Big Pocket","7.","4.1 out of 5 stars","9"
"63","PetSupplies","Cat Professional Recovery Suit for Abdominal Wounds or Skin Diseases, E-Collar Alternative for Cats and Dogs, After Surgery Wear, Pajama Suit (Elephant Pattern, S)","2.","4.0 out of 5 stars","38"
"64","PetSupplies","Halloween Pet Bat Wings,Cat Halloween Costume Cat Costume Cute Cat Halloween Bat Wings Adjustable Pet Costumes,Pet Halloween Bat Wings Costume for Cat Dog Bat Costume.","4.","3.8 out of 5 stars","10"
"65","PetSupplies","Cute Costume Bunny Rabbit Hat with Ears for Cats & Small Dogs Party Costume Easter Pet Accessory Headwear","4.","4.0 out of 5 stars","132"
"66","PetSupplies","Girls Party T-Shirt | Young Ladies Lets Pawty Birthday Cake Graphic Tee | Cute Kitty Short Sleeve Top Lightweight Internet Cat Apparel | Adorable Daywear Merchandise Gift for Children & Teens","4.","4.0 out of 5 stars","34"
"67","PetSupplies","Turtleneck Small Dog Jumper,Dog Sweater Winter Puppy Clothes Cute Knitted Vest for Knit Cold Weather Outfit Dogs and Cats (L), Green","14.","4.1 out of 5 stars","1"
"68","PetSupplies","Dog Jumper Winter, Turtleneck Knitting Sweater Winter Warm Coat Puppy Pullover Cable Knitted Clothes Outfit Knit Jumper Cat Jacket Apparel Sweatshirts Chihuahua Poodle Christmas Clothing(Grey, XS)","5.","3.9 out of 5 stars","5"
"69","PetSupplies","Large Storage Boxes - Large Linen Fabric Foldable Storage Cubes Bin Box Containers with Lid and Handles for CAT Apparel & Accessories, CAT Coats, CAT Toys, CAT Clothing-Gray","12.","3.8 out of 5 stars","51"
"70","PetSupplies","Cat Surgery Recovery Suit,Male Female Anti Licking Cat Onesies,Cone E-Collar Alternative Pet Vest Post Operative Abdominal Wounds Protector,Prevent Licking for Small Cat,Puppy Doughnut (XL)","23.","3.8 out of 5 stars","2"
"71","PetSupplies","Cats in Movies a Purrfect T-Shirt Gift for cat Lovers who Love Retro Films","21.","4.2 out of 5 stars","380"
"72","PetSupplies","Cat Clothes Cat Jumpers for Cats Only Breathable Cat Outfit Onesie Soft Sphynx Cat Kitten Clothes Cat Clothing Coat Sweater T Shirt Knitted Dog Fleece Jumper Pyjamas for Hairless Cats（Pink，S）","4.","3.8 out of 5 stars","19"
"73","PetSupplies","Dog Cat Knitted Jumper Pullover Washable Puppy Purple Sweater Coat Winter Warm Pet Pullover Sweater Coat for Small Medium Puppy Cat Vest Knitwear Sweatshirt Outfit for Yorkshire Chihuahua (S, Purple)","3.",NA,"4"
"74","PetSupplies","Cat Paw Gloves 3 Pairs Kawaii Gloves Cat Paws Cosplay Faux Fur Plush Cat Gloves Lion Paws Fingerless Gloves for Girls Women","13.",NA,"2,076"
"75","PetSupplies","2 Pcs Dog Shirts, Cute Breathable Puppy Sweatshirt with Fruit Patterns, Summer Beach Wear T-Shirt, Soft Pet Vest Clothes, Pet Clothing for Small Medium Boys and Girls Dog Cat (S)","6.",NA,"60"
"76","PetSupplies","2PCS Pet Headwear Hat Cute Costume Bunny Rabbit Hat with Ears Pet Cap Party Costume Headwear Rabbit Hat Headband for Cats and Small Dogs Kitten Puppy Party Costume Accessory Headwear","5.",NA,"2"
"77","PetSupplies","Pet Dog Turtleneck Knitting Sweater Coat Winter Warmer Thickening Pullover Knitwear Crochet Coat Clothes for Small Medium Large Dog Puppy Cat (S, White)","8.",NA,"9"
"78","PetSupplies","Cat Surgery Recovery Suit, Medical Pet Shirt Soft Pajama Suit After Surgery Wear Cat Medical Vest Recovery Clothes Anti Licking for Abdominal Wounds Skin Diseases Sterilization(Purple, M)","4.",NA,"123"
"79","PetSupplies","1pcs Cat Beanie Hats for Women Cute Striped Thermal Cat Hats Crochet Beanie Hat Womens Cats Ears Beanie Hats Animal Hat Beanie Hat for Girls Ladies Valentines Gifts Woolly Hats (Black)","8.",NA,"30"
"80","PetSupplies","Mane For Cat, Lion Mane Costume For Cats, Lion Mane For Dog, Pet Cat Costumes For Halloween Christmas, Adjustable Pet Costume Lion Mane Wig With Ears, Furry Pet Clothing Accessories, Wig For Puppy","25.",NA,"276"
"81","PetSupplies","Recovery Suit Cat, Cat Bodysuit After Surgery, Anti-Leaking, Prevent Licking After Surgery, Weaning and Keeping Warm Recovery Cloth Suit for Cats, Dogs (M, Pink)","6.",NA,"177"
"82","PetSupplies","2 Pack Dog Shirts Small Dog Clothes Pet Shirts Puppy Fruit Printed T-Shirt Summer Thin Vest Soft Breathable Puppy Sweatshirt Cool Outfit Pyjamas Apparel for Small Dogs Puppies Cats (S)","3.",NA,"492"
"83","PetSupplies","Small Dog Camo Hoodie Shirt Chihuahua Clothes for Boys Puppy Tee Shirt for Cat Yorkshire Toy Poodle Green XS","12.",NA,"194"
"84","PetSupplies","Cat Clothes Winter Hillylolly Pet Jumper Cat Sweater Warm Cat Clothing Cute Knitted Jumper for Cats Clothing Pink Strawberry Sweater Winter Pet Clothes (S)","9.",NA,"85"
"85","PetSupplies","Womens Hoodies, Cute Kangaroo Pouch Hoodie Sweatshirt Hooded Pocket with Big Pouch for Small Pets","14.",NA,"28"
"86","PetSupplies","Dog Cat Jumper Warm Pet Sweater Knitwear Coat Apparel Autumn Winter Dog Clothes(Grey-S)","14.",NA,"16"
"87","PetSupplies","Small Dog Hoodie,Fashion Soft Cotton Fleece Pet Security Hoodie Hooded Clothes Warm Autumn Winter Coat Puppy Hoodie T-Shirt Clothes Costume Apparel for Puppy Small Dogs Black","8.",NA,"172"
"88","PetSupplies","Famous YouTube Gamer Boys Girls Jumper Lightning Cats Hoodie Cotton Sweatshirts Kids Tops","5.",NA,"128"
"89","PetSupplies","Cat Camouflage Recovery Suit, Cat Surgery Suit for Abdominal Wounds or Skin Diseases, Pet Physiological Clothes, Cone E-Collar Alternative, Cat Onesie Anti Licking Vest Shirt, Radom Pattern (M)","8.",NA,"446"
"90","PetSupplies","Printed Puppy Shirt 6 Packs - Soft Breathable Pet T-Shirt Puppy Dog Clothes Soft Sweatshirt for Small Dogs and Cats L","4.",NA,"10"
"91","PetSupplies","Girls Boys Oversized Hoodie Cat Dusky Pink Snuggle World Book Day Blanket Super Soft Warm Fleece Kangaroo Pocket Hooded Blankets Gift for Girls & Boys Age 3-13 Years","7.",NA,"17"
"92","PetSupplies","Small Dog Stripe Jumpsuit Puppy Pajamas with Pant Comfy Cotton Pet Clothes Cat Apparel Pyjamas PJS Shirt Boys Winter Jammies Brown Size XL","14.",NA,"15"
"93","PetSupplies","2 Pcs Warm Pet Shirt Footprints Pattern Pet Plush Pullover Soft Dog Plush Warm Hoodies Coat Apparel for Rabbit Cat Kitten Dog Puppy (XXS)",NA,NA,"284"
"94","PetSupplies","Flower Puppy Princess Tutu Dress for Small Dog Cat Girls Birthday Party Fancy Costume Female Dog Clothes Pet Apparel",NA,NA,"85"
"95","PetSupplies","Umbrella Snuggling Cats Pin Black and White cat Surrounded By Fallen Leaves Brooch Cartoon Cute Animal Backpack Lapel Custom Badges Jewelry Gifts For Friends",NA,NA,NA
"96","PetSupplies","Pet Shirt Dog Clothes for Yorkie Soft Cotton Breathable Pajamas Colorful Stripe Large Cat Apparel Sleepwear Outfit Easy on Doggy Costume Jumpsuit for Puppy Walking Training Outdoor Grey XXL",NA,NA,NA
"97","PetSupplies","Check each product page for other buying options. Price and other details may vary based on product size and colour.","9.","3.9 out of 5 stars","1,119"
"98","PetSupplies","Cat Halloween Costumes Cat Surgical Recovery Suit for Abdominal Wounds or Skin Diseases,Substitute E-Collar & Cone,Cat Holiday Costume Kitten Halloween Eve Party Cat Cosplay Costume","22.","4.2 out of 5 stars","43"
"99","PetSupplies","Girls Outfit Blue Cat Printing Hoodie & Joggers Boys Sportswear Clothing Sets","6.","4.1 out of 5 stars","68"
"100","PetSupplies","Dog Pajamas Dinosaur Pjs Jumpers for Small Medium Dogs Girl Boy Fleece Lined Warm Coat Winter Pullover Puppy Chihuahua Clothes Cat Apparel 2 Legs Homewear Cold Weather Autumn Yellow M","7.","3.9 out of 5 stars","836"
