"","prod_name","title","reviewer","review","date","ratings","type_of_purchase"
"1","automet womens 2 piece outfits lounge matching sets two piece linen shorts crop tops 2023 trendy clothes summer vacation set","bien relacin precio","allison mace","great fit",2024-02-08,3,"verified purchase"
"2","automet womens 2 piece outfits lounge matching sets two piece linen shorts crop tops 2023 trendy clothes summer vacation set",NA,"dutchy","bought the largest size xl and it is more like a sm in australian sizing very disappointed as this is a cute set that would be perfect for my up coming travels",2024-02-26,5,"verified purchase"
"3","automet womens 2 piece outfits lounge matching sets two piece linen shorts crop tops 2023 trendy clothes summer vacation set",NA,"allison mace","nicely cut good seamstress not linen cotton",2024-02-08,1,"verified purchase"
"4","automet womens 2 piece outfits lounge matching sets two piece linen shorts crop tops 2023 trendy clothes summer vacation set",NA,"dutchy","very well made fortunately s was smallest size as it equates roughly to an australian size   looked really good on my side  daughter  not the size  who it was intended for  would buy a medium for her",2024-02-26,5,"verified purchase"
"5","automet womens 2 piece outfits lounge matching sets two piece linen shorts crop tops 2023 trendy clothes summer vacation set",NA,"nicciannem","the quality is very poor and the cut that i received is not similar to the picture advertised",2023-06-09,1,"verified purchase"
"6","automet womens 2 piece outfits lounge matching sets two piece linen shorts crop tops 2023 trendy clothes summer vacation set",NA,"teresa j","i ordered an xl as a standard australian size   size guide indicated that this would be the right size however the outfit would have been closer to a small size  the quality of the material was also pretty cheap",2024-01-09,3,"verified purchase"
"7","automet womens 2 piece outfits lounge matching sets two piece linen shorts crop tops 2023 trendy clothes summer vacation set",NA,"burcu turkmener","honestly this is a shame for amazon terrible product cant even be bothered to write and i have to waste my time returning",2023-12-21,5,"verified purchase"
"8","automet womens 2 piece outfits lounge matching sets two piece linen shorts crop tops 2023 trendy clothes summer vacation set",NA,"katie","ordered an xl and its more like an ",2023-08-23,1,"verified purchase"
"9","automet womens 2 piece outfits lounge matching sets two piece linen shorts crop tops 2023 trendy clothes summer vacation set",NA,"angela","this is marked size  and would barely fit a size  very disappointing",2023-07-07,1,"verified purchase"
"10","automet womens 2 piece outfits lounge matching sets two piece linen shorts crop tops 2023 trendy clothes summer vacation set",NA,"kim","la tela no es de muy buena calidad bonito fit",2023-09-21,1,"verified purchase"
"11","automet womens 2 piece outfits lounge matching sets two piece linen shorts crop tops 2023 trendy clothes summer vacation set","great fit great material great versatility get it","allison mace","love this set ordered a l im   and a ddd have it in army green and black probably going to get navy can dress up or down have worn shorts with another top and top with another skirt its linen wore it to some hot day concerts and super comfy dont mind my togo bev container haha shorts are high waisted enough that you arent showing your stomach unless youre really got your hands in the air waving them like you just to dont carealso the automet shorts style is the best ordered another seller to try in different color and wasnt a fan of the shorts these are more tailored with a side zipper and elastic in back way more flattering others were pull on and elastic all the way around",2024-02-08,3,"verified purchase"
"12","automet womens 2 piece outfits lounge matching sets two piece linen shorts crop tops 2023 trendy clothes summer vacation set","very comfortable and elegant","dutchy","very comfortable and stylish but i would recommend that you go up a size cause it does fit very small",2024-02-26,5,"verified purchase"
"13","automet womens 2 piece outfits lounge matching sets two piece linen shorts crop tops 2023 trendy clothes summer vacation set","shrunk to a childs size","hdolly","when this product arrived i was so excited im a smallmedium in most things and i got the medium in this and it was so cute the tops hem came just to the waistline of the shorts and was nice and flowy and the shorts were perfect and soft then i washed it and dried it now the top fits like a sports bra and the shorts look like volleyball shorts they didnt just shrink a little they shrunk a lot they arent even in a condition that i would feel comfortable donating so disappointing wish i could return or get a refund definitely do not recommend this product",2023-06-27,1,"verified purchase"
"14","automet womens 2 piece outfits lounge matching sets two piece linen shorts crop tops 2023 trendy clothes summer vacation set","shrinks and zippers fail","hdolly","i ordered this and wore it one time out of the country it was cute despite the top being a little boxy in fit washed it accordingly and it shrunk the top became a crop top the zipper on the shorts failed on me and it got stuck in the top with the whole side opened  i missed the window period to return it since i was out of the country for several weeks so i have no choice but to keep something that didnt even retain its wear for more than one time so disappointing",2023-08-25,5,"verified purchase"
"15","automet womens 2 piece outfits lounge matching sets two piece linen shorts crop tops 2023 trendy clothes summer vacation set","definitely does not recommend","grace"," polyester   cotton unlike the description says not linen at all not see throught feels like cheap thin scrubs purchased the black version which was not great but okay definitely do not recommend amazon should filter the quality of the products sold on their platform more thoroughly how can we report incorrect product information",2023-04-29,5,"verified purchase"
"16","automet womens 2 piece outfits lounge matching sets two piece linen shorts crop tops 2023 trendy clothes summer vacation set","esperaba la tela fuera de lino es mas gruesa","samantha","la blusa queda muy grande el short si queda bien pero pense era lino y es tipo lino  no me gusto mucho la tela",2023-07-03,5,"verified purchase"
"17","automet womens 2 piece outfits lounge matching sets two piece linen shorts crop tops 2023 trendy clothes summer vacation set","no es lino","gin s","las tallas vienen reducidasla tela no es lino es popelina",2023-07-20,1,"verified purchase"
"18","automet womens 2 piece outfits lounge matching sets two piece linen shorts crop tops 2023 trendy clothes summer vacation set","thin material larger than expected","stphanie lemire","the material is very thin but if you get black its somehow not seethrough the size was way larger than expected i got a medium because thats what amazon recommended but i should have stuck with my true size small i would have liked to return but it doesnt have free returns",2023-05-08,3,"verified purchase"
"19","automet womens 2 piece outfits lounge matching sets two piece linen shorts crop tops 2023 trendy clothes summer vacation set","super cute but not worth it for the price","stphanie lemire","i loved this set when i bought it and wore it its so cute and just makes you feel put together i wore it washed it according to the directions and it shrunk in the wash and the front seem on the shorts started to come apart so unfortunately i cant wear it anymore cause its now too small and id have to see a few areas ",2023-04-28,1,"verified purchase"
"20","automet womens 2 piece outfits lounge matching sets two piece linen shorts crop tops 2023 trendy clothes summer vacation set","love the shorts shirt is alright","laura elena sandoval rivera","height  weight  lbs measurements waist in hips in chest ci am usually not a fan of ordering sets because my top and bottoms are usually not the same size but this fits well i really love the shorts and they are super comfortable my only issue is the zipper is a little weird and doesnt zip easily at the seam but still works the shirt isnt super flattering on me it makes me feel a bit boxy so i probably wont wear the set together but i love both pieces this is more of a me thing lol great quality material not itchy and is sturdy overall  def recommend",2023-05-23,1,"verified purchase"
"21","automet womens 2 piece outfits lounge matching sets two piece linen shorts crop tops 2023 trendy clothes summer vacation set","adorable","allison mace","great for the price super flattering and can dress up and down wash on hand wash and air dry otherwise the fabric will not hold up but so far its been great as long as you take gentle care",2024-02-08,3,"verified purchase"
"22","automet womens 2 piece outfits lounge matching sets two piece linen shorts crop tops 2023 trendy clothes summer vacation set","slightly different than image","dutchy","the material quality was really good but the picture was a bit different then the actual producttop the square neckline was very high compared to the image and was more of a crop top then a  normal top it also lacked the striped pattern seen in the imagebottoms the shorts were thicker in material and seems true to size i have long legs so buying shorts before trying them on is always a risk but these were just long enough and fit wellwhen not compared to the image they provide the set is actually very cute but i would advise going up a size",2024-02-26,5,"verified purchase"
"23","automet womens 2 piece outfits lounge matching sets two piece linen shorts crop tops 2023 trendy clothes summer vacation set","not great but not bad","makinsey","im not sure if the negative reviews are for different colours than the ones i got but i ordered the purple and light tan and they are both decent quality the material of mine is a linen  rayon blend as shown in the description and the fit is quite flattering i sized up one size the items that i received are definitely worth the price imo",2024-01-20,1,"verified purchase"
"24","automet womens 2 piece outfits lounge matching sets two piece linen shorts crop tops 2023 trendy clothes summer vacation set","not flattering on curvy body","gina","if you have any tummy insecurities this is not the set for you the shorts were not flattering on my body type however my friend is skinny no curves more athletic build and it looked cute on her it hugged every nook and cranny in all the wrong places the shirt is cute but i have  a big chest so it made the crop top look super short",2023-06-14,5,"verified purchase"
"25","automet womens 2 piece outfits lounge matching sets two piece linen shorts crop tops 2023 trendy clothes summer vacation set","very nice set","kiteen marie","great set nice material",2023-04-29,4,"verified purchase"
"26","automet womens 2 piece outfits lounge matching sets two piece linen shorts crop tops 2023 trendy clothes summer vacation set","love this","amazon customer","cant wait to wear this on my cruise the fabric is soft not that stiff faux linen which i dislike i usually wear a  and the xl fit perfect it is a little on the see through side but nothing the right under garments cant remedy  just ordered it in black as well",2023-10-07,4,"verified purchase"
"27","automet womens 2 piece outfits lounge matching sets two piece linen shorts crop tops 2023 trendy clothes summer vacation set","poor quality and size","vdn","i ordered a medium which is a size i take all the time and what i received looks like a small i could not zip the side or the back the fabric does not feel anything like linen very disappointing",2023-07-31,2,"verified purchase"
"28","automet womens 2 piece outfits lounge matching sets two piece linen shorts crop tops 2023 trendy clothes summer vacation set","obsessed with this set","motrees","i dont typically write reviews on amazon but this set deserves one i am   i typically range from a ml on sizing i ordered a l in this set because some of the comments suggested it shrunk when drying i washed mine dried for a few minutes then hung to try and it fits perfect the shorts are slightly big but super comfortable i wanted longer shorts to wear in disney since i carry a majority of my weight in my legslower stomach these were perfect i would consider myself someone with larger thighs and the shorts did not ride up or leave me chafed after a full day in epcot the material is great and not see through i was very comfortable all day great for anyone looking for something comfy they can move in",2023-02-07,5,"verified purchase"
"29","automet womens 2 piece outfits lounge matching sets two piece linen shorts crop tops 2023 trendy clothes summer vacation set","shorts and top set","motrees","really disappointed with this set quality is very poor top is very badly stitched and puckered around the arms probably wont last one wash looks somewhat similar to the photo but not worth the spend",2023-10-22,5,"verified purchase"
"30","automet womens 2 piece outfits lounge matching sets two piece linen shorts crop tops 2023 trendy clothes summer vacation set","great set","enis d","bought for my daughter for a vacation was so flattering and stylish on her washes up well and doesnt overly stretch out during wear like some linen will do",2023-09-03,5,"verified purchase"
"31","automet womens 2 piece outfits lounge matching sets two piece linen shorts crop tops 2023 trendy clothes summer vacation set","weird fit","allison mace","the shorts were too big and the arm holes were too big but i ordered the size that matched the chart measurements would be cute if it fit properly",2024-02-08,3,"verified purchase"
"32","automet womens 2 piece outfits lounge matching sets two piece linen shorts crop tops 2023 trendy clothes summer vacation set","love","dutchy","i just got this in the safe green and after trying it on i immediately added the black to my cart it is so cute and flattering i am  lbs and ordered the small for reference the top is cropped but it shows just a hint of midriff because the shorts are highwaisted enough itll be adorable with flat sandals or a wedge for just about any occasion after reading the reviews ill definitely line dry to avoid shrinking",2024-02-26,5,"verified purchase"
"33","automet womens 2 piece outfits lounge matching sets two piece linen shorts crop tops 2023 trendy clothes summer vacation set","nice summer outfit","naomi","i ordered the size that was most appropriate for my thick waist and the set was too big  there is ample stretchy elastic in the back of the shorts such that they pull on easily and were generously sized at the waist  the pleats on the front of the shorts are flattering and the top is boxy without being frumpy  i am  dd busty and about a size  right now and ordered the xl because i didnt want it too tight  the armholes are way too big and i need a size or two smaller  order your regular size on this  cute set  would be great for travel as the pieces would mix easily with other tops and bottoms",2023-11-21,1,"verified purchase"
"34","automet womens 2 piece outfits lounge matching sets two piece linen shorts crop tops 2023 trendy clothes summer vacation set","cute set","michelle staich","cute set and thin material is perfect for the summer",2023-04-01,1,"verified purchase"
"35","automet womens 2 piece outfits lounge matching sets two piece linen shorts crop tops 2023 trendy clothes summer vacation set","beautiful but shrinks like crazy","djstuart","this is a beautiful set just plan ahead for the big shrink that happensthe photos the cream one is a size large it wouldve been the perfect size asis but i read the reviews about shrinking so i ordered the black in a size xl im not at a place in my life mom of young kids where i can air dry things  so i knew it would have to adapt to going through the washer and dryer not ideal but i wanted to see if it could hold upthe photos with the black are postdrying it shrunk to probably a medium its shorter shorts and more cropped than id like but its honestly fineit seems like great quality the waistband has a lot of give even with the side zipper  im small busted so the top works well for mefor the price im pleased",2023-07-25,5,"verified purchase"
"36","automet womens 2 piece outfits lounge matching sets two piece linen shorts crop tops 2023 trendy clothes summer vacation set","recommend with a few caveats","jenn h","im a pretty basic medium maybe a small in some things i got a m in this and i wish i could have gotten a large in the pants and a small in the top the tops arm holes are pretty big which means my bra is visible under the arms the pants even though they stretch at the back singe are still a little tight im keeping it because neither of those things are bad enough to send back the color is gorgeous the material is nice i would recommend this unless youre a very different size on topbottom then i think it might be a hard to find the right fitsize",2023-07-14,4,"verified purchase"
"37","automet womens 2 piece outfits lounge matching sets two piece linen shorts crop tops 2023 trendy clothes summer vacation set","versatile outfit","amazon customer","i ordered this two piece outfit for my honeymoon i absolutely loved it i really liked that since it was a piece set i could wear the shirt with different bottoms and the bottoms with a different top the top is true to size and has a comfortable amount of stretch the shorts are the reason this didnt get  stars the shorts close with a side zipper and dont have much stretch so its a little difficult to close however once you get them closed they are comfortable you just have to yank it a little bit first",2023-03-10,5,"verified purchase"
"38","automet womens 2 piece outfits lounge matching sets two piece linen shorts crop tops 2023 trendy clothes summer vacation set","sizing is not as stated very small medium fit my grandaughter who is a size  xsmall","amazon customer","nice set looking forward to receive and was disappointed it was so small glad my grandaughter liked it and fit her perfectly  she is a size xsmall i am size  medium",2023-06-20,4,"verified purchase"
"39","automet womens 2 piece outfits lounge matching sets two piece linen shorts crop tops 2023 trendy clothes summer vacation set","cute yet zipper problem","jesshaymaker","so the style is really cute and comfort except the zipper i do not have a flat stomach nor flat breast i first attempted to just zip it up but after i caught my side skin in the zipper i looked at it and held it away from my skin ouch had to hold down my breast to see zipper not do that again but to unzip it i had to look again to get it down little difficult little frustrated thank goodness i did not have to urgently pee i did not think im that far off from the normal shape women",2023-07-17,4,"verified purchase"
"40","automet womens 2 piece outfits lounge matching sets two piece linen shorts crop tops 2023 trendy clothes summer vacation set","inconsistent sizing  too s and too l","erika genova","i purchased two of each size as ive learned through experience from china  i kept the pink m peach m red s green s  one has to order two sizes and i should say the peach shorts came with a broken zipper the others did not thank goodness  the zipper is not needed in these shorts in sizes s or m  overall i love the price styling and comfort of this twopiece shorts outfit",2023-08-20,4,"verified purchase"
"41","automet womens 2 piece outfits lounge matching sets two piece linen shorts crop tops 2023 trendy clothes summer vacation set","perfect but shrinks","allison mace","this set was absolutely perfect to wear during summer walking around in mexico it was cute but breathable and very comfortable",2024-02-08,3,"verified purchase"
"42","automet womens 2 piece outfits lounge matching sets two piece linen shorts crop tops 2023 trendy clothes summer vacation set","nice set but hard to size","dutchy","i had originally ordered a size small in this and it shrunk like crazy in the wash  even with cold water and air drying it so i overcompensated i guess by buying a large but the cut was wayyy to big so i messed up again im normally an xss but apparently for this product am an m   lbs petite build for reference material feels nice but is not stretchy except at the waistband where theres an elastic band cute set if you can pick the right size",2024-02-26,5,"verified purchase"
"43","automet womens 2 piece outfits lounge matching sets two piece linen shorts crop tops 2023 trendy clothes summer vacation set","great pair","jordan m","i love that i look puttogether without even trying in this two piece outfit it fits pretty well the only issue is that sometimes the band is a little tight everything else fits perfectly my favorite part is that it is not at all seethrough definitely a great outfit that is true to size and true to color",2023-10-26,1,"verified purchase"
"44","automet womens 2 piece outfits lounge matching sets two piece linen shorts crop tops 2023 trendy clothes summer vacation set","i wanna give this  stars","amazon customer","i loved this and wore it multiple times since i bought it a couple months ago but its already started to lose its color just straight going from green to white",2023-06-08,4,"verified purchase"
"45","automet womens 2 piece outfits lounge matching sets two piece linen shorts crop tops 2023 trendy clothes summer vacation set","not as disturbed","elizabeth roberts","i ordered an xl and it looked even smaller than a medium too small and quality aint all that will be returning",2023-08-24,4,"verified purchase"
"46","automet womens 2 piece outfits lounge matching sets two piece linen shorts crop tops 2023 trendy clothes summer vacation set","beware cute but shrinks","torey bennett","i loved this set i got a large and it fit perfectly loose fit not too short comfy and cute but i machine washed cold and hung dry as the tag directed and both pieces shrank now the shirt is a crop top and the shorts still fit but are shorter than i wanted super bummed",2023-11-20,4,"verified purchase"
"47","automet womens 2 piece outfits lounge matching sets two piece linen shorts crop tops 2023 trendy clothes summer vacation set","not  linen","amazon customer","i bought this because it said it was linen only  is linen the rest is rayon i like natural fabrics that breathe in hot weatherthe top is skimpy and short like a crop top which i would like better if it were longeroverall nice fit design qualityim getting on other colorsgood buywish the top was longer though",2023-07-04,3,"verified purchase"
"48","automet womens 2 piece outfits lounge matching sets two piece linen shorts crop tops 2023 trendy clothes summer vacation set","cute but runs big","dylan","i was conflicted if i like it or not it runs big the top fit me perfect but the bottom was a bit large i ended up keeping it because it still looked cute and it was on a limited deal",2023-07-20,3,"verified purchase"
"49","automet womens 2 piece outfits lounge matching sets two piece linen shorts crop tops 2023 trendy clothes summer vacation set","be careful in the wash","kitzia nin poniatowska","i love this but it shrunk a little when washing i dozed up and it justtttt fit just read carefully for sizing i would size up if you have issues with midsection like i dobut overall great purchase i have bought already more in other colors",2023-06-11,4,"verified purchase"
"50","automet womens 2 piece outfits lounge matching sets two piece linen shorts crop tops 2023 trendy clothes summer vacation set","almost but not","kitzia nin poniatowska","the top was a too short for me",2023-08-18,4,"verified purchase"
"51","aurola","me encantaron","tt","the shorts are well fitted with a tight waistband to cinch the waist the material is super soft and comfortable would recommend",2023-07-30,4,"verified purchase"
"52","aurola","best shorts ever","shorts are okay ","lowkey shouldnt have sized down but still happy with them",2023-11-09,5,"verified purchase"
"53","aurola",NA,"tt","the fabric is quite thick butt scrunch does the job perfectly and love this colour",2023-07-30,3,"verified purchase"
"54","aurola",NA,"lucy","amazing quality so comfortable and cute but unfortunately they do ride up apart from that ive had no problems im ft around kg and got a medium fits perfect ",2023-11-13,5,"verified purchase"
"55","aurola",NA,"sunny","the pant is true to the size perfect for my need and highly recommended this seller",2023-08-28,5,"verified purchase"
"56","aurola",NA,"aimee","fabric is nice and soft fits wellonly downside is the waist and legs rolls downup during work out so hesitant to wear themconsidering they were  id expect them to somewhat stay in placei got a size l  i am  and  kgs",2023-08-14,5,"verified purchase"
"57","aurola",NA,"dewi blythe","the first time i wore these the seem holding the waistband came undone its gotten worse since disappointed in the quality given the price",2023-05-06,4,"verified purchase"
"58","aurola",NA,"shorts are okay ","was hesitant to buy these shorts but im so glad i did the material is smooth and nice and fits so well on my body squat proof for me  i was in between xs and s and got a s",2023-11-09,5,"verified purchase"
"59","aurola",NA,"dianne page","sper cmodos los recomiendo mucho sin duda los volver a comprar son de buena calidad y nicos",2024-01-24,3,"verified purchase"
