"","prod_name","title","reviewer","review","date","ratings","type_of_purchase"
"510","aurola","look closely at the picture","ina gomez","i should have paid closer attention to the picture i realize spandex is spandex but these are rouched right between the buttocks and it really separates which for me was not attractive with a smaller size it just looks like the thong of your panties these did not work out for me",2022-10-31,4,"verified purchase"
"511","aurola","so comfy","nelle","i originally bought aurolas leggings  loved them so much i had to try their shorts theyre just as great they dont roll up too much and theyre squat proof",2022-07-18,4,"verified purchase"
"512","aurola","fits true to size","lexi cutter","absolutely love these shorts",2023-03-21,5,"verified purchase"
"513","aurola","wrong material","lexi cutter","this material pilled after washing it once if youre getting aurola spandex make sure you get from the store and get the style dream",2024-01-23,5,"verified purchase"
"514","aurola","best gym shorts ive ever had","amazon customer","i have  colors of these exact shorts no complaints at all i always hated the shorts where the scrunch in the back is crazy noticeable but with these shorts the scrunch is so not noticeable at all but still give that great look",2022-08-05,5,"verified purchase"
"515","aurola","cutest gym shorts","ash kennedy","the media could not be loaded                                                                                    love the fit and quality just like alphalete and other top brands",2023-11-16,1,"verified purchase"
"516","aurola","dupee","stephanie marie","i love these shorts they are soft and make my butt look good",2023-04-14,5,"verified purchase"
"517","aurola","horrible customer service","alex cistrunk","this was the second pair of aurola leggingsshorts i bought that ripped after  wear i emailed the company to see if they could replace them hoping that since i paid  that they would send a new pair since these were clearly faulty the company informed me that i would have to send the product back and pay for shipping to china or could not send them back and only get half my money back so somehow i have to pay for their faulty product will not be ordering from aurola again",2023-01-31,5,"verified purchase"
"518","aurola","love these","alex cistrunk","i absolutely love these shorts and this brand i work out  times a week and these are the only shorts i will wear to the gym they are so unbelievably comfortable and flattering i wear them without underwear and i seriously feel like i am not even wearing pants they are incredible and i feel my most confident in shorts when i am wearing these i highly recommend this brand the size is accurate too also they are pretty stretchy i am  pounds and i wear a size small",2023-04-20,4,"verified purchase"
"519","aurola","so comfortable and great colors","linda m ferguson","love these shorts wore them to a spin class and didnt have much issue they do ride up on the thighs while spinning but in a normal workout i dont think itd be an issue i got the one that is not listed as sheer however the sides are kind of sheer while the back and front seem to be pretty good coverage fits well i am   and normally order a small in leggings for the compression and a medium in shorts so i would say these are true to size",2022-12-31,4,"verified purchase"
"520","aurola","extremely flattering","linda m ferguson","worth all your money",2023-06-09,1,"verified purchase"
"521","aurola","disappointed tbh","naidelyn franco","the media could not be loaded                                                                                    i never write reviews on amazon but this disappointed me sm im writing onei was just getting ready to go to the gym n i hear a tear as i was putting these shorts on and i was like  awww these are the cutest shorts and theyre overhyped on tiktok so i bought a couple pair ive only worn these times  to the gym this was going to be the rd buuuut nope i mean im not too bummed bc im getting a replacement but its still upsetting i had high hopes for the quality considering its almost  my shien ones that cost me  have better quality than the aurola leggings",2022-12-13,4,"verified purchase"
"522","aurola","aurola shorts","francis shubert jr","love the fit and colors of these shorts",2023-07-01,2,"verified purchase"
"523","aurola","wow","angela g","very cute shorts makes the booty look good not as great quality as alphalete but still good",2023-02-14,5,"verified purchase"
"524","aurola","not it","hailee","loved these at first wore them twice doing things that only would have caused friction in the thighs and the washed them inside out and this happened to the back its like its worn down and its extra soft in two spots in the back with fuzzies i dont know what happened i own two pairs of the leggings and this hasnt happened to themaside from that they roll up on my thighs when walking or riding my bike",2023-07-20,5,"verified purchase"
"525","aurola","if you are athletic or have a thicker waist size up","hailee","im   pounds athletic with a booty im usually s size small but got a medium and its perfect i tried on the small and it fits great but just a little too snug on the waist im a medium in all of their products even bras but i like the shape material and texture",2023-03-18,2,"verified purchase"
"526","aurola","i want to get more colours","daniela gargiulo","these shorts are really flattering and comfy the waistband is rly nice but the bottomleg parts do roll up sometimes not super squat proof but they are less sheer than other collections ive gotten from this brand i got a size m and they fit great",2023-10-15,2,"verified purchase"
"527","aurola","best gym shorts","michelle g macrae","i buy a lot of high end brands of gym wear and when i discovered aurola i was shocked they are amazing quality and are so flattering there is a slight scrunch that is the perfect touch they are also quite sweat proof and i always feel comfortable working out in them",2022-12-26,5,"verified purchase"
"528","aurola","very good pair of shorts","sandra tzouros","absolutely love the color i got flame orange i say it is squat proof material is half as thin as the nvgtn scrunch seamless shorts i loved how the waistband wasnt so thick and tight around the stomach",2022-06-29,5,"verified purchase"
"529","aurola","thinripped","ashley","im not sure if i would purchase again but if youre considering these i would size down the leggings ride up so much and the fabric is quite thin not thin enough to show underwear but thin enough to show the slightest sweat at first it didnt bother me because i can wear them around the house or during a light workout i decided to wear them to work out today havent even washed once and it ripped in the center",2023-04-15,5,"verified purchase"
"530","aurola","my favorite shorts","grace","for reference im  and  lbs i wear a small in all of the aurola bottomsthese are by far my favorite shorts for the gym they are the only things i wear they are a fabulous dupe for the alphalete amplify collectiontheyre durable they last theyre so flattering and theyre comfortable i cant recommend them highly enough they have such cute colors and a lot of varietymy only complaint is the waist band is a tad high for me and i usually fold it down but i dont mind doing that and i would rather fold it down than have it be too low and i believe the price has gone up from when i first started buying from aurola but the price has gone up on everything and i still think theyre worth it",2023-10-04,5,"verified purchase"
"531","aurola","old ones  new ones","amazon customer","i like the original aurola better i like that theyre trying to improve but the new gusset gives me camel toe and theres no compression what so ever dont fix something that isnt broken",2022-07-06,4,"verified purchase"
"532","aurola","all inseams are different","adahtude","sometimes the inseam is way longer or wayyy to short i returned these just bc i didnt end up loving the color but super cute and flattering",2023-07-31,3,"verified purchase"
"533","aurola","love","amber brittany","big fan of aurola leggings  shorts i have quite a few pairs",2022-07-26,5,"verified purchase"
"534","aurola","better than name brands","casey","these are amazing super compressive and a bit stiffer in material compared to their dream line which is what i personally prefer on certain gym exercises to feel more compression and sucked in already bought  more pairs absolutely in love super affordable and honestly compared to other big well known brands that ive bought fromthese are much better",2022-11-30,5,"verified purchase"
"535","aurola","very cute but horrible defect in the fabric of the front part in the shorts","casey","i love these shorts so flattering stretchy and comfortable but these two lines disappointed me so much expensive shorts for this come on it was also clearly already bought then returned once probably for the same reason ridiculous the leggings are good tho",2022-12-01,5,"verified purchase"
"536","aurola","i love these ","liz","these are my favorite gym shorts they are squat proof cute and comfortable they dont give me camel toe lol the pink is very vibrant which i love",2024-01-10,5,"verified purchase"
"537","aurola","yellow see through","liz","these shorts were overall comfy and fit really well stretchy and thin however they are see through",2022-09-06,3,"verified purchase"
"538","aurola","great quality","kayla tucker","great quality product the material is really good great for the gym",2022-08-10,3,"verified purchase"
"539","aurola","see through","kayla tucker","love the fit but see through very sheer",2023-01-07,5,"verified purchase"
"540","aurola","a must buy","irelandrenee","these shorts are perfect",2022-08-06,5,"verified purchase"
"541","aurola","worth it ","jessica","the media could not be loaded                                                                                    ok i am obsessed  i wear these shorts every morning for my workout and let me tell you not only are they hugging in all the right places but the colors and fit  squat proof   someone needs to cut me off i keep buying more ",2022-06-24,4,"verified purchase"
"542","aurola","super stretchy","celina","love love these shorts a little see through but definitely manageable stays on while lifting and overall super soft and comfortable",2023-02-21,5,"verified purchase"
"543","aurola","yellow is more like orange","m","so soft a little see through but love not satisfied with the yellow color wish it was a brighter lighter yellow rather than an orange yellow it looks different from the picture",2022-06-24,4,"verified purchase"
"544","aurola","expensive for pantyhose material","m","these feel like pantyhose not quite seethrough definitely do not dry them they will get all pili i dont recommend buying for the price im not very good quality material",2022-07-25,3,"verified purchase"
"545","aurola","i need in every color asap","cassidy"," that is all i can say im lbs  and got a small perfect fit",2022-09-11,3,"verified purchase"
"546","aurola","disappointed","smk","purchased  of these shorts in different colors both ripped after a few washes material is thin",2023-09-06,3,"verified purchase"
"547","aurola","great gym shorts","smk","so good for the gym fit perfectly and not too tightuncomfortable in the front",2023-01-02,5,"verified purchase"
"548","aurola","seamless leggings","amazon customer","these are by far the best biker shorts ever i do recommend you size up i used to get a small as im   lb i then bought medium and that was so much more better and breathable i ended up getting a large just because i do bloat a lot",2023-06-14,5,"verified purchase"
"549","aurola","perfect fir","your bfs fav","these are squat proof and true to size i weigh  and im wearing a size small",2022-07-10,1,"verified purchase"
"550","aurola","cute but transparent af","bianca","i love the material but it is super see through even when i wear nude underwear i feel like youre looking at my bare cheeks ",2022-08-13,5,"verified purchase"
"551","champion women's","nice shorts","debkrose","the inseam is a bit short but i have a weird torso so thats part of the problem i like these shorts they are very comfortable for working out",2016-08-23,4,"verified purchase"
"552","champion women's","practice shorts","daisies","my granddaughter just loves these shorts for basketball practice",2016-12-03,4,"verified purchase"
"553","champion women's","great pair of shorts","vickie c","just love these shorts  the color is vibrant just what i wanted  i use them to work out or anytime really  the fabric is soft and lightweight too for those hot days coming soon",2017-02-20,5,"verified purchase"
"554","champion women's","good quality","mrs bull","i like the bright pink color fit as expected its nice to find shorts that arent too short or too long the inner lining is attached and it has a real champion embroidered logo unlike the last socalled champion shorts i bought on amazon that seemed to be knockoffs",2014-09-17,5,"verified purchase"
"555","champion women's","perfect elastic waist for pregnant moms","claudia cardenas","my pregnancy shorts i live in southern california and there really was no way i could have survived my pregnancy by wearing anything other than these shorts they are super breathable have such a comfortable elastic that has grown with me thru my entire pregnancy and really have been a life saver i am   lbs to begin with however i packed on heavy in the hips during my pregnancy and the large size have really stuck in there with me they still have a nice flowy fit as seen on the model but the elastic waist has given way to my growth the length is nice and modest hitting mid thigh so i dont ever feel like i am over exposed i wear these shorts to the gym to lounge around the house and pair them with a comfortable tee to run errands with my husband i loved them so much that i went ahead and ordered  more pairs and made them my go to staple",2018-07-06,5,"verified purchase"
"556","champion women's","awesome workout shorts in fun colors","k schoff","love these casual cute and cheap  nice product holding up well after many washes  colors are fun and cute  really like these shorts",2015-09-06,5,"verified purchase"
"557","champion women's","cool material when exercising seems to be made very well bought two more in different colors","thenightfly","nice breathable material cool when exercising",2015-06-13,4,"verified purchase"
"558","champion women's","perfect work out shorts","chelanne soriano","my go to work out shorts love these keep in mind that they are mid length so they fit longer than running shorts but shorter than basketball shorts",2020-08-03,5,"verified purchase"
"559","champion women's","four stars","irishis","very comfortable good fit and bright color",2015-07-16,5,"verified purchase"
"560","champion women's","love them","jenny d","make sure you check out the measurement sizing chart i am a size  and normally i am an xl but ordered a xxl bc of the size chart they fit great i didnt want them to be too tight they will be used for yard work and such glad i went with xxl not an xl xl would have fit but been too tight to do physical work they would have been decorative shorts not active wear got the purple and its a beautiful color super comfortable",2016-06-27,4,"verified purchase"
"561","champion women's","mesh makes them great for workouts","gypsy","great color cool",2015-04-12,4,"verified purchase"
"562","champion women's","five stars","margaret burkhart","very comfortable",2015-04-15,5,"verified purchase"
"563","champion women's","love them","pisces lady","love them size is accurate very comfortable",2015-05-07,5,"verified purchase"
"564","champion women's","three stars","carroll smallegan","like the shorts but they seem to run smaller than  i expected they are quite short",2014-08-24,5,"verified purchase"
"565","champion women's","retro","parf","very nice shorts retro and airy bargain",2018-07-01,3,"verified purchase"
"566","champion women's","great shorts","nicole","overall i like them and they are perfect to run around in overall comfortable but my older version had a slightly more comfortable inside waistband",2023-11-24,5,"verified purchase"
"567","champion women's","functional rather than flattering","coconut earth monkey","these fit nicely are comfortable and work great for workouts or bedtime  they arent the most flattering shorts in the world baggy  shapeless but they are very functional",2015-02-26,4,"verified purchase"
"568","champion women's","just what i was looking for","katherine parker","more red than pink but comfortable fit",2016-05-31,4,"verified purchase"
"569","champion women's","favorite casual shorts","elle","i am in love with these shorts they are soft and loose and the band isnt too tight or itchy or any of the other problems ive experienced with other mesh shorts the length is perfect to be a causal sporty short but short enough that it is clearly made for women the fabric is very light and even after a few washes it still hasnt pilled up like many other mesh shorts ive had i am careful with drying them however these shorts are great to run errands in hang around the house on a hot day or go to the gym in i love them so much i am about to buy another pair after writing this review",2013-07-17,5,"verified purchase"
"570","champion women's","love these","tmac","super cute in black the medium fits just as suspected but they are womens so take that into account great fit they are short so if you dont like your thighs showing you might want to get a longer pair but these are great for summer these will fit nicely on my suitcase and will be coming to the beach with them very cute",2022-03-10,5,"verified purchase"
"571","champion women's"," xl after reading reviews and these shorts fit very comfortably","mr blake","i sized up to an xl after reading reviews and these shorts fit very comfortably  i usually wear a large but ordered an xl and they fit great great quality for the price they are a bit see through but if you wear nude underwear or dark you wont be able to tell would def order more for reference im   lbs and prefer a comfortable fit i use these to lounge in and light workouts",2017-08-05,4,"verified purchase"
"572","champion women's","wrong color sent","susu","seller sent the incorrect color so i ended up with two very similar shade bright blue pairs of shorts instead of this bright green and one blue pair i am disappointed but the green is sold out now and the shorts are exactly what i expected to recieve aside from the color so i kept them even though they are the wrong color great fitnot too long and not too short the  in inseam put these mid thigh normal champion good quality that i expected",2019-01-22,5,"verified purchase"
"573","champion women's","fits as expected and great color","yeanette luffman","beautiful color you dont usually find in stores great quality",2022-02-18,1,"verified purchase"
"574","champion women's","soft","me","soft and quality",2023-11-30,5,"verified purchase"
"575","champion women's","it doesnt have a drawstring","selena","im in my new postpartum body  needed some looser shorts then my regular biker shortstheyre soft  breathable they dont have a drawstring but theyre getting the job done",2023-05-31,4,"verified purchase"
"576","champion women's","doesnt lay smooth if you dont want to roll the waistband","kristen","i wanted to wear the waistband on these shorts in the upright position  i believe that some want to roll the waistband down if i am remembering the pictures in the reviews correctly  if you want to roll it then youll probably like these shorts  i found that the stitching for the waist did not lay flat in the upright position  it poofed out slightly  i was disappointedi really thought these would be my goto athletic shorts  i returned ",2023-06-13,4,"verified purchase"
"577","champion women's","cute but not for curvy ppl","zoee","i like these overall and wear them often  however i had to stretch them out pulling on the elastic until some of the threads started to rip weve all been there to fit if i had gone a size up theyd be too big though as someone with big hips and a short torso i dont think these are the best fit for my body type i dont wear them for fashion ill just say that lol the product overall is solid though nothing wrong just not meant for a petite but thick body",2022-08-24,3,"verified purchase"
"578","champion women's","inconsistent sizing","l adams","i bought these in red last year and i was pretty happy with how they fit another customer commented that if you have a small waist and thicker thighs they bunch in the crotch  this is  accurate but theyre still very comfortable and work great for casual weari ordered two more pairs in different colors black and royal blue but the same size as the red ones they definitely do not fit the same the blue pair has a much smaller waist and are also tighter in the legs the black pair fits the same in the waist as my red pair but the legs are definitely tighter im going to keep them because they do stretch some and theyre still fine for lounging but its frustrating that the sizing is so off",2021-06-30,4,"verified purchase"
"579","champion women's","poor quality","vandella","the fit of the shorts is ok but the waistband construction is a deal breaker inside elastic is white and sewing is wavy so the white shows against black mesh",2023-11-28,4,"verified purchase"
"580","champion women's","comfy shorts but tight elastic","amazon customer","the shorts have elastic band but its not very stretchy fits fine on waist but sucks pulling up for thicker bottom ladies my body type is muscular with smaller waist and bigger booty",2022-08-27,2,"verified purchase"
"581","champion women's","good lil shorts","rebecca turner","great for camping lounging hiking cant beat the price imo and i miss this material of shorts i cant find it too often now",2022-08-09,4,"verified purchase"
"582","champion women's","updated review  not all colors are the same","smile saurus","newest update i washed and wore the black pair twice the logo fell offmy updated review i ordered three pairs they all shipped separately the first pair to arrive was black size medium they fit fine but the mesh was somewhat stiff the second pair was a french blue size medium and these are much shorter and way tighter than the black ones  that is because they are not the same style of shorts whatsoever the third pair was a cornflower blue but i canceled those because the first two pairs were blah the first was stiff the second was too small  and these are supposed to be the same style and the same fit just different colorsmy original review was these shorts are not as soft as the older style of champion shorts",2022-08-09,4,"verified purchase"
"583","champion women's","good fit comfy and colorful","c alderfer","these shorts were just what i wanted to replace a pair of mesh reversible shorts that ive owned for many years these fit just rightnot too large or too small not too short and not too long i always struggle to find shorts that arent so long that they make me hot while still keeping me modest i think these fit the bill they are also loose enough to move without being baggythey are reversible but i doubt ill reverse them much the inner color shows the white champion waistband and the bottom hem is the opposite color the inner color is a solid fabric where the outer is the mesh with little holes my only complaint is that the hula blue is really more purple than blue still its very attractive and will work fine with my tshirts i just ordered two more pairsalso very pleased with quick shipping from seller",2013-05-10,2,"verified purchase"
"584","champion women's","love them","neek","i initially ordered a m since that is my normal size im  and lbs they fit perfect but i prefer to wear my shorts high rise so i returned the m for a l i also am scared of shrinking so i sized now up waiting for the large to come in mail but i know i will love them the mesh is so breathable and cute stick with your normal size if you want to wear them mid rise and size up if you want to wear them high rise",2019-06-26,4,"verified purchase"
"585","champion women's","nice shorts","taylor hollihan","these are pretty good shorts they are comfortable and i use them for both working out and leisure im pear shaped  and  lbs and i got a medium the medium fits well but i might have preferred a large instead because i like my workout shorts to be a little bit more loose the only thing i was disappointed with was the fact that there are no pockets to me thats a little inconvenient but other than that i really like them",2020-05-31,4,"verified purchase"
"586","champion women's","comfortable","hs","i like the shortshad seemingly the same exact ones already but they are a few years old i dont think that this plasticlike mesh fabric shrinks does it because my older mediums are way smaller then my new onesso changes to the sizing or a more generous cut i guess oh well i do like the shorts they are for comfort and function more than anythingkept them am plenty happy enough if you are comparing them to shorts you already had fyi sizing may run a little bigger then it used to",2017-10-13,4,"verified purchase"
"587","champion women's","not impressed at all","kdmmease","cheaply made cant be the real thing",2023-09-29,4,"verified purchase"
